{
  "compose": 1,
  "id": "ch13-intensional",
  "title": "Intensional Transitive Verbs (§13.4.4)",
  "domain": {
    "multiLetterNames": true,
    "constants": {
      "e": "f s g n a b l m o w"
    },
    "variables": {
      "e": "x y z",
      "s": "w0 w w' w''",
      "st": "p q",
      "et": "P Q",
      "set": "R S"
    }
  },
  "lexicon": [
    {
      "words": [
        "Frodo"
      ],
      "denotation": "f"
    },
    {
      "words": [
        "Sam"
      ],
      "denotation": "s"
    },
    {
      "words": [
        "Gandalf"
      ],
      "denotation": "g"
    },
    {
      "words": [
        "Sauron"
      ],
      "denotation": "n"
    },
    {
      "words": [
        "Aragorn"
      ],
      "denotation": "a"
    },
    {
      "words": [
        "Boromir"
      ],
      "denotation": "b"
    },
    {
      "words": [
        "Legolas"
      ],
      "denotation": "l"
    },
    {
      "words": [
        "Gimli"
      ],
      "denotation": "m"
    },
    {
      "words": [
        "Galadriel"
      ],
      "denotation": "w"
    },
    {
      "words": [
        "Bilbo"
      ],
      "denotation": "bi"
    },
    {
      "words": [
        "Strider"
      ],
      "denotation": "st"
    },
    {
      "words": [
        "Pippin"
      ],
      "denotation": "pi"
    },
    {
      "words": [
        "Tom"
      ],
      "denotation": "tm"
    },
    {
      "words": [
        "Elrond"
      ],
      "denotation": "el"
    },
    {
      "words": [
        "Saruman"
      ],
      "denotation": "sr"
    },
    {
      "words": [
        "Moria"
      ],
      "denotation": "mr"
    },
    {
      "words": [
        "rides",
        "ride"
      ],
      "denotation": "Lx.ride(w0,x)"
    },
    {
      "words": [
        "sings",
        "sing"
      ],
      "denotation": "Lx.sing(w0,x)"
    },
    {
      "words": [
        "rests",
        "rest"
      ],
      "denotation": "Lx.rest(w0,x)"
    },
    {
      "words": [
        "reads",
        "read"
      ],
      "denotation": "Ly.Lx.read(w0,x,y)"
    },
    {
      "words": [
        "finds",
        "find"
      ],
      "denotation": "Ly.Lx.find(w0,x,y)"
    },
    {
      "words": [
        "sees",
        "see"
      ],
      "denotation": "Ly.Lx.see(w0,x,y)"
    },
    {
      "words": [
        "guards",
        "guard"
      ],
      "denotation": "Ly.Lx.guard(w0,x,y)"
    },
    {
      "words": [
        "ring"
      ],
      "denotation": "Lx.ring(w0,x)"
    },
    {
      "words": [
        "map"
      ],
      "denotation": "Lx.map(w0,x)"
    },
    {
      "words": [
        "gate"
      ],
      "denotation": "Lx.gate(w0,x)"
    },
    {
      "words": [
        "dragon"
      ],
      "denotation": "Lx.dragon(w0,x)"
    },
    {
      "words": [
        "hobbit"
      ],
      "denotation": "Lx.hobbit(w0,x)"
    },
    {
      "words": [
        "elf"
      ],
      "denotation": "Lx.elf(w0,x)"
    },
    {
      "words": [
        "the"
      ],
      "denotation": "LX.Ix.X(x)"
    },
    {
      "words": [
        "every",
        "Every"
      ],
      "denotation": "LX.LY.Ax[X(x) -> Y(x)]"
    },
    {
      "words": [
        "some",
        "Some"
      ],
      "denotation": "LX.LY.Ex[X(x) & Y(x)]"
    },
    {
      "words": [
        "a"
      ],
      "denotation": "LX.LY.Ex[X(x) & Y(x)]"
    },
    {
      "words": [
        "necessarily"
      ],
      "denotation": "Lp.Aw'[acc(w0)(w') -> p(w')]"
    },
    {
      "words": [
        "possibly"
      ],
      "denotation": "Lp.Ew'[acc(w0)(w') & p(w')]"
    },
    {
      "words": [
        "necessarily_deon"
      ],
      "denotation": "Lp.Aw'[deon_acc(w0)(w') -> p(w')]"
    },
    {
      "words": [
        "possibly_deon"
      ],
      "denotation": "Lp.Ew'[deon_acc(w0)(w') & p(w')]"
    },
    {
      "words": [
        "necessarily_meta"
      ],
      "denotation": "Lp.Aw'[meta_acc(w0)(w') -> p(w')]"
    },
    {
      "words": [
        "possibly_epist"
      ],
      "denotation": "Lp.Ew'[epist_acc(w0)(w') & p(w')]"
    },
    {
      "words": [
        "possibly_meta"
      ],
      "denotation": "Lp.Ew'[meta_acc(w0)(w') & p(w')]"
    },
    {
      "words": [
        "necessarily_epist"
      ],
      "denotation": "Lp.Aw'[epist_acc(w0)(w') -> p(w')]"
    },
    {
      "words": [
        "seeks",
        "seek"
      ],
      "denotation": "LR.Lx.seek(w0,x,R)"
    },
    {
      "words": [
        "believes",
        "believe"
      ],
      "denotation": "Lp.Lx.Aw'[dox(w0)(x,w') -> p(w')]"
    },
    {
      "words": [
        "wants",
        "want"
      ],
      "denotation": "Lp.Lx.Aw'[boul(w0)(x,w') -> p(w')]"
    }
  ],
  "rules": {
    "composition": {
      "functionApplication": true,
      "nonBranchingNodes": true,
      "predicateModification": true,
      "predicateAbstraction": true
    }
  },
  "exercises": [
    {
      "title": "A. Extensional verbs (FA)",
      "instructions": "An extensional verb like finds takes a type-e individual as object. Compose by Function Application. The resulting truth conditions require the object to exist in the evaluation world w0: find(w0,f,ιz[ring(w0,z)]) is false if there is no ring in w0.",
      "items": [
        {
          "sentence": "Frodo finds the ring.",
          "tree": "[.S [.DP Frodo ] [.VP [.V finds ] [.DP [.D the ] [.NP ring ] ] ] ]",
          "targets": [
            "find(w0,f,ιz[ring(w0,z)])"
          ]
        },
        {
          "sentence": "Gandalf sees the dragon.",
          "tree": "[.S [.DP Gandalf ] [.VP [.V sees ] [.DP [.D the ] [.NP dragon ] ] ] ]",
          "targets": [
            "see(w0,g,ιz[dragon(w0,z)])"
          ]
        }
      ]
    },
    {
      "title": "B. Intensional verb (IFA)",
      "instructions": "seeks takes a property intension ⟨s,⟨e,t⟩⟩. The bare NP \"dragon\" has extension ⟨e,t⟩; IFA wraps it as λw0.λz.dragon(w0,z) before applying seeks. The result, seek(w0,f,λw.λz.dragon(w,z)), is true even if no dragon exists in w0 (Quine 1956).",
      "items": [
        {
          "sentence": "Frodo seeks a dragon.",
          "tree": "[.S [.DP Frodo ] [.VP [.V seeks ] [.NP dragon ] ] ]",
          "targets": [
            "seek(w0,f,λw.λz.dragon(w,z))"
          ]
        },
        {
          "sentence": "Sam seeks the ring.",
          "tree": "[.S [.DP Sam ] [.VP [.V seeks ] [.NP ring ] ] ]",
          "targets": [
            "seek(w0,s,λw.λz.ring(w,z))"
          ]
        }
      ]
    },
    {
      "title": "C. Existential import: finds and seeks",
      "instructions": "Compare the two verbs directly. \"Frodo finds a dragon\" requires an actual dragon, so QR the DP to get existential quantification over w0-individuals. \"Frodo seeks a dragon\" (IFA) carries no such commitment. The truth conditions take different shapes: existential quantification ∃x against application to a property intension seek(w0,f,λw.…).",
      "items": [
        {
          "sentence": "Frodo finds a dragon. (existential import — QR the object DP)",
          "tree": "[.S [.DP Frodo ] [.VP [.V finds ] [.DP [.D a ] [.NP dragon ] ] ] ]",
          "targets": [
            "∃x[dragon(w0,x) ∧ find(w0,f,x)]"
          ]
        },
        {
          "sentence": "Frodo seeks a dragon. (no existential import — IFA)",
          "tree": "[.S [.DP Frodo ] [.VP [.V seeks ] [.NP dragon ] ] ]",
          "targets": [
            "seek(w0,f,λw.λz.dragon(w,z))"
          ]
        }
      ]
    }
  ]
}
